<?xml version="1.0" encoding="UTF-8"?>

<?xml-model href="ODD_electre_giraudoux.rng" lang="fr" type="application/xml" schematypens="http://relaxng.org/ns/structure/1.0"?>
<?xml-model href="ODD_electre_giraudoux.rng" lang="fr" type="application/xml" schematypens="http://purl.oclc.org/dsdl/schematron"?>

<!DOCTYPE ns1:TEI SYSTEM "DTD_electre_giraudoux.dtd">
<?xml-stylesheet type="text/xsl" href="electre_stylesheet.xsl"?>
<TEI xmlns="http://www.tei-c.org/ns/1.0">

 <teiHeader>

  <fileDesc>
   <titleStmt>
    <title>Électre</title>
    <author key="Jean Giraudoux (1882-1944)" ref="https://isni.org/isni/000000012117821X">Jean Giraudoux</author>
   </titleStmt>
     
   <editionStmt><p>Encodage ludique par Anne Bugner, pour le master TNAH de l'école des Chartes, année 2023.</p></editionStmt>

   <publicationStmt>
    <publisher>Éditions Bernard Grasset</publisher>
    <date when-iso="1937">1937</date></publicationStmt>

   <sourceDesc>
    <bibl>
     <title>Électre</title>
      <author>Jean Giraudoux</author>
      <publisher>Librairie Générale Française</publisher>
      <date when-iso="1987">1987</date>
      <idno type="ISBN">978-2-253-00129-4</idno>
    
     </bibl>
     <bibl><distributor facs="https://fr.wikisource.org/wiki/%C3%89lectre_(Giraudoux)"/></bibl>
    </sourceDesc>
   </fileDesc>

   <profileDesc>
    <langUsage>
     <language ident="fr">French</language></langUsage>

   <textDesc>
     <domain type="art"/> 
     <factuality type="fiction"/>      
    <derivation type="réécriture"/>    
    <interaction type="partial" active="singular" passive="world"/>  
    <purpose type="distrayant" degree="high"/>
    <purpose type="instructif" degree="high"/>
    <purpose type="déprimant" degree="medium"/>  

   </textDesc>

   <particDesc>
    <listPerson type="fictional">
              
               <!-- Premier groupe: personnages canoniques issus de la littérature grecque classique -->
     <person xml:id="el">
      <persName>Électre</persName></person>
     <person xml:id="o">
       <persName>Oreste</persName></person>
     <person xml:id="cly">
      <persName>Clytemnestre</persName></person>
     <person xml:id="eg">
      <persName>Égisthe</persName></person>
     <person xml:id="em1">
      <persName>Première Euménide</persName></person>
     <person xml:id="em2">
      <persName>Deuxième Euménide</persName></person>
     <person xml:id="emd3">
      <persName>Troisième Euménide</persName></person>
     <person xml:id="jd">
      <persName>Le Jardinier</persName>
     <note>
       La tragédie d'inspiration, celle d'Euripide, présentait le personnage du Laboureur, à qui Égisthe marie Électre pour l'éloigner du palais.
     </note></person>
               

               <!-- Personnages non actants dans nos extraits, mais mentionnés -->
     <person xml:id="agm">
      <persName>Agamemnon</persName></person>
     <person xml:id="atree">
      <persName>Atrée</persName></person>
     <person xml:id="thyeste">
      <persName>Thyeste</persName></person>
     <person xml:id="chrysothemis">
      <persName>Chrysothémis</persName></person>
     <person xml:id="cassandre">
      <persName>Cassandre</persName></person>

               <!-- Second groupe: ajouts propres à Giraudoux -->
     <person xml:id="mdt">
      <persName>Le Mendiant</persName></person>
     <person xml:id="fns">
      <persName>La Femme Narsès</persName></person>
      
              <!-- Enfin, puisqu'il en est question plusieurs fois dans notre texte -->
     <person xml:id="abd"><persName>anybody</persName><note>Expression du collectif: tout le monde, et personne en particulier. 
      Peut également désigner, par effet de mise en abyme et d'ironie tragique, le public.</note></person>

    <listRelation>
                  <!-- La famille d'Électre, les Atrides, dans la pièce -->
     <relation name="adelphes" mutual="#el #o #chrysothemis"/>
     <relation name="mère" active="#cly" passive="#el #o #chrysothemis"/>
     <relation name="père" active="#agm" passive="#el #o #chrysothemis"/>
     <relation name="époux" mutual="#cly #agm"/>
     <relation name="fiancés" mutual="#el #jd"/>
                 
                  <!-- Le passif des parents d'Électre : le meurtre d'Agamemnon -->
     <relation name="haine" active="#cly" passive="#agm"/>
     <relation name="amants" mutual="#cly #eg"/>
     <relation name="amants" mutual="#agm #cassandre"/>
     <relation name="meurtriers" active="#cly #eg" passive="#agm"/>
     <relation name="meurtriers" active="#cly #eg" passive="#cassandre"/>
   
                  <!-- Le passif de la famille paternelle d'Électre: la malédiction des Atrides -->
     <relation name="adelphes" mutual="#atree #thyeste"/>
     <relation name="haine" mutual="#atree #thyeste"/>
     <relation name="tortionnaires" active="#em1 #em2 #em3" passive="#atree #thyeste"/>
     <relation name="père" active="#atree" passive="#agm"/>
     <relation name="père" active="#thyeste" passive="#eg"/>
                
                  <!-- Les sentiments des uns pour les autres dans la pièce -->         
     <relation name="haine" active="#el" passive="#cly"/>
     <relation name="attirance_cachée" active="#jd" passive="#el"/>
     <relation name="attirance_cachée" active="#eg" passive="#el"/>
     <relation name="amour_très_freudien" active="#el" passive="#agm #o"/>
     <relation name="affection" mutual="#mdt #el; #o"/>
     <relation name="affection" mutual="#mdt #fns"/>
     <relation name="affection" mutual="#fns #el"/>
     <relation name="mépris" active="#em1 #em2 #em3" passive="#o"/>
     <relation name="mépris" active="#em1 #em2 #em3" passive="#el"/>  
    </listRelation>
   </listPerson>
  </particDesc>
 </profileDesc>
</teiHeader>

<text>
 <front>
  <docTitle>
   <titlePart>Électre<lb/>
              Pièce en deux actes
   </titlePart></docTitle>    
   <set><p>Cour intérieure dans le palais d'Agamemnon.</p></set>
  </front>

  <body>
   <div1 type="act" n="1">
    <head>ACTE I</head>


    <div2 type="scene" n="1" ana="Scène_d'exposition" decls="dialogues">
     <head>Scène I</head>

     <stage type="entrance">Un étranger (Oreste) entre escorté de trois petites filles, au moment où, de l’autre côté, arrivent 
            le jardinier, en costume de fête, et les invités villageois.</stage>
               
     <sp who="#em1" toWhom="#abd">
      <speaker rend="sc">Première petite fille.</speaker>
      <p><seg ana="enallage">Ce qu’<persPronouns corresp="#jd">il</persPronouns> <w type="&p1;" function="&desc;">est</w> <emph xml:id="beauté">beau</emph>, <persName ref="#jd" type="&phr;">le jardinier</persName> <pc type="&exc;" ana="&ett;">!</pc></seg></p></sp>
               
     <sp who="#em2" toWhom="#em1">
      <speaker rend="sc">Deuxième petite fille.</speaker>
      <p><seg ana="enallage"><persPronouns corresp="#em1">Tu</persPronouns> <w type="&p1;" function="&ac;">penses</w> <pc type="&exc;" ana="&ett;">!</pc></seg> C’<w type="&p1;" function="&ac;">est</w> <emph xml:id="temps">le jour de</emph> son <emph corresp="#&bt;">mariage</emph>.</p></sp>
               
     <sp who="#em3" toWhom="#o">
      <speaker rend="sc">Troisième petite fille.</speaker>
      <p>Le <emph corresp="#&tps;">voilà</emph>, <persName ref="#o" type="&phr;">monsieur</persName>, votre <emph xml:id="statut_royal">palais</emph> d’<persName ref="#agm" type="&pn;">Agamemnon</persName><pc type="&exc;" ana="&ett;">!</pc></p></sp>
       
     <sp who="#o" toWhom="#em1 #em2 #em3">
      <speaker rend="sc">L'Étranger.</speaker>
      <p><emph xml:id="laideur">Curieuse</emph> façade <pc type="&exc;" ana="surprise">!</pc><pc type="&ssp;" ana="&desv;">…</pc>  Elle <w type="&p1;" function="&ac;">est</w> d’aplomb <pc type="&int;" ana="&rh;">?</pc></p></sp>
       
     <sp who="#em1" toWhom="#o">
      <speaker rend="sc">Première petite fille.</speaker>
      <p><seg ana="prétérition">Non. Le côté droit <w type="&p1;" function="&hab;">n’existe</w> pas. <persPronouns corresp="#abd">On</persPronouns> <w type="&p1;" function="&hab;">croit</w> le voir, mais c’<w type="&p1;" function="&hab;">est</w> un <emph xml:id="folie">mirage</emph>. C’<w type="&p1;" function="&hab;">est</w> comme le jardinier qui <w type="&p1;" function="&ac;">vient</w> là, qui <w type="&p1;" function="&ac;">veut</w> <persPronouns corresp="#o">vous</persPronouns> parler. <persPronouns corresp="#jd">Il</persPronouns> ne <w type="&p1;" function="&ac;">vient</w> pas. <persPronouns corresp="#jd">Il</persPronouns> ne <w type="&fp1;" function="&poss;">va pas pouvoir</w> dire un mot.</seg></p></sp>
             
      <sp who="#em2" toWhom="#o">
      <speaker rend="sc">Deuxième petite fille.</speaker>
      <p>Ou <persPronouns corresp="#jd">il</persPronouns> <emph xml:id="bestiaire" corresp="#&ld;"> <w type="&fp1;" function="&poss;">va braire</w></emph>. Ou <emph corresp="#&bst; #&ld;">miauler</emph>.</p></sp>
       
     <sp who="#jd" toWhom="#o">
      <speaker rend="sc">Le Jardinier.</speaker>